{"schema_version":1,"reviewer":"codex-terra-high","disposition":"ACCEPT","coverage":{"case_count":30,"all_cases_reviewed":true,"shape_distribution_verified":true,"source_spans_verified":true,"hard_negatives_verified":true,"prompt_neutrality_verified":true,"schedule_balance_verified":true},"findings":[],"summary":"All 30 cases, 44 cited source spans, grade judgments, three repository-wide non-test absence claims, hard negatives, truth entries, digests, composite manifest identity, neutral shared prompt, and alternating 15/15 paired schedule verify against the pinned clean local sources."}
