{"schema_version":1,"reviewer":"codex-sol-high","disposition":"ACCEPT_WITH_CORRECTIONS","coverage":{"case_count":30,"all_cases_reviewed":true,"shape_distribution_verified":true,"source_spans_verified":true,"hard_negatives_verified":true,"prompt_neutrality_verified":true,"schedule_balance_verified":true},"findings":[{"severity":"P2","task_id":null,"field":"question_sources[*].taxonomy_sha256","problem":"Both question-source files record taxonomy SHA-256 b83ede34ec163ba49dd60b36a4f5f8908b21140bb81d973f29f2ac3c963d62c0, but the referenced taxonomy file hashes to 7989919031881a6a44062a52304dd14eb1955883a508fe47bda2c128d04bd986. The manifest uses the latter value, so the source files' own taxonomy bindings are inconsistent with the frozen manifest and taxonomy.","required_correction":"Replace the stale taxonomy_sha256 in both question-source files with the actual taxonomy digest, then refresh their manifest file hashes and the composite question-set identity digest."},{"severity":"P2","task_id":"avail-tsx-contract-form-submit","field":"required_groups.form-submit-contract.alternatives[0].spans","problem":"The frozen claims distinguish action-branch error objects from exceptions thrown during conversion or onSubmit and assert which outcomes reach submit's root.server update. The sole required span is Form, but that behavior also depends materially on control.handleSubmit propagating the callback result while rethrowing callback exceptions, which is implemented in createFormControl and is not frozen as required evidence.","required_correction":"Add direct grade-2 dependency evidence for createFormControl's handleSubmit result propagation and exception rethrow behavior to this case, or narrow the material claim to behavior established solely inside Form. Refresh the affected case, question-source, schedule, and composite identity digests."}],"summary":"All 30 cases, pinned source identities, existing paths, file hashes, byte ranges, qualified symbols, judgments, shape counts, three absence claims, hard negatives, prompt, and 15/15 alternating schedule were rechecked. No P1 defect remains, but the stale taxonomy bindings and missing Form submission dependency evidence require correction before execution."}
