{"schema_version":1,"reviewer":"codex-terra-high","disposition":"ACCEPT","coverage":{"case_count":30,"all_cases_reviewed":true,"shape_distribution_verified":true,"source_spans_verified":true,"hard_negatives_verified":true,"prompt_neutrality_verified":true,"schedule_balance_verified":true},"findings":[],"summary":"All 30 cases, both taxonomy bindings, frozen source revisions and tree hashes, 44 source spans, grade judgments, three repository-wide absence claims, file and case digests, composite identity, neutral shared prompt, and 15/15 alternating schedule verified. The narrowed Form submission claim is fully and sufficiently established by module.Form alone."}
