{"schema_version":1,"reviewer":"codex-terra-high","disposition":"ACCEPT","coverage":{"case_count":30,"all_cases_reviewed":true,"shape_distribution_verified":true,"source_spans_verified":true,"hard_negatives_verified":true,"prompt_neutrality_verified":true,"schedule_balance_verified":true},"findings":[{"severity":"P3","task_id":null,"field":"question_set_identity.sha256","problem":"The composite question-set identity hash has no documented canonical input and is not verified by the execution runner; the individually pinned question-source hashes and all 30 task digests do verify correctly.","required_correction":"Document the canonical composite serialization for this hash and verify it during preflight, or remove the unused field and retain the individually verified source hashes as the identity authority."}],"summary":"All 30 cases, required groups, grade-2 spans, hard negatives, pinned commits, source hashes, paired task digests, 15/15 first-arm balance, shared prompt neutrality, and three repository-wide no-answer claims were verified directly against the clean pinned local sources. No scored output, cidx result, network resource, or prior assistant run output was consulted."}
